{
 "contrato": "1.0.0",
 "gerado_em": "2026-10-28T18:35:33Z",
 "snapshot": "2026-10-28",
 "sintetico": true,
 "fonte": {
  "nome": "DADO SINTÉTICO — não é CNJ/DataJud",
  "url": "https://datajud-wiki.cnj.jus.br/api-publica/",
  "citacao": "Dado sintético para desenvolvimento. Nenhum processo real."
 },
 "tribunal": "TJSP",
 "grau": "G1",
 "evento": "Primeiro movimento da família Julgamento (TPU 193 e filhos)",
 "grade_meses": [
  0,
  1,
  2,
  3,
  4,
  5,
  6,
  7,
  8,
  9,
  10,
  11,
  12,
  13,
  14,
  15,
  16,
  17,
  18,
  19,
  20,
  21,
  22,
  23,
  24,
  25,
  26,
  27,
  28,
  29,
  30,
  31,
  32,
  33,
  34,
  35,
  36,
  37,
  38,
  39,
  40,
  41,
  42,
  43,
  44,
  45,
  46,
  47,
  48,
  49,
  50,
  51,
  52,
  53,
  54,
  55,
  56,
  57,
  58,
  59,
  60,
  61,
  62,
  63,
  64,
  65,
  66,
  67,
  68,
  69,
  70,
  71,
  72,
  73,
  74,
  75,
  76,
  77,
  78,
  79,
  80,
  81,
  82,
  83,
  84,
  85,
  86,
  87,
  88,
  89,
  90,
  91,
  92,
  93,
  94,
  95,
  96,
  97,
  98,
  99,
  100,
  101,
  102,
  103,
  104,
  105,
  106,
  107,
  108,
  109,
  110,
  111,
  112,
  113,
  114,
  115,
  116,
  117,
  118,
  119,
  120
 ],
 "varas": [
  {
   "codigo": "9001",
   "nome": "1ª Vara Cível de Sorocaba",
   "municipio": "Sorocaba"
  },
  {
   "codigo": "9002",
   "nome": "2ª Vara Cível de Sorocaba",
   "municipio": "Sorocaba"
  },
  {
   "codigo": "9003",
   "nome": "3ª Vara Cível de Sorocaba",
   "municipio": "Sorocaba"
  }
 ],
 "classes": [
  {
   "codigo": "7",
   "nome": "Procedimento Comum Cível"
  },
  {
   "codigo": "12",
   "nome": "Despejo por Falta de Pagamento"
  }
 ],
 "curvas": [
  {
   "vara": null,
   "classe": null,
   "metodo": "kaplan-meier",
   "n": 7275,
   "eventos": 7149,
   "censurados": 126,
   "sobrevivencia": [
    1.0,
    0.9901,
    0.9708,
    0.945,
    0.9143,
    0.8802,
    0.8435,
    0.8052,
    0.7662,
    0.7271,
    0.6884,
    0.6506,
    0.614,
    0.5787,
    0.545,
    0.5128,
    0.4823,
    0.4533,
    0.4259,
    0.4,
    0.3755,
    0.3524,
    0.3306,
    0.31,
    0.2905,
    0.2722,
    0.2549,
    0.2387,
    0.2234,
    0.209,
    0.1955,
    0.1828,
    0.1708,
    0.1597,
    0.1492,
    0.1394,
    0.1303,
    0.1216,
    0.1136,
    0.1061,
    0.0991,
    0.0926,
    0.0865,
    0.0808,
    0.0755,
    0.0705,
    0.0659,
    0.0616,
    0.0575,
    0.0538,
    0.0503,
    0.047,
    0.044,
    0.0411,
    0.0384,
    0.036,
    0.0336,
    0.0315,
    0.0294,
    0.0276,
    0.0258,
    0.0241,
    0.0226,
    0.0211,
    0.0198,
    0.0185,
    0.0173,
    0.0162,
    0.0152,
    0.0142,
    0.0133,
    0.0124,
    0.0116,
    0.0109,
    0.0102,
    0.0095,
    0.0089,
    0.0083,
    0.0078,
    0.0073,
    0.0068,
    0.0064,
    0.0059,
    0.0055,
    0.0052,
    0.0048,
    0.0045,
    0.0042,
    0.0039,
    0.0037,
    0.0034,
    0.0032,
    0.003,
    0.0027,
    0.0026,
    0.0024,
    0.0022,
    0.0021,
    0.0019,
    0.0018,
    0.0017,
    0.0016,
    0.0014,
    0.0013,
    0.0012,
    0.0012,
    0.0011,
    0.001,
    0.0009,
    0.0009,
    0.0008,
    0.0008,
    0.0007,
    0.0006,
    0.0006,
    0.0005,
    0.0005,
    0.0005,
    0.0004,
    0.0004,
    0.0004
   ],
   "ic_inferior": [
    1.0,
    0.9847,
    0.9614,
    0.9323,
    0.8988,
    0.8623,
    0.8236,
    0.7838,
    0.7435,
    0.7035,
    0.6642,
    0.626,
    0.5892,
    0.5539,
    0.5203,
    0.4884,
    0.4582,
    0.4297,
    0.4027,
    0.3774,
    0.3534,
    0.3309,
    0.3096,
    0.2897,
    0.2709,
    0.2531,
    0.2364,
    0.2207,
    0.206,
    0.1923,
    0.1793,
    0.1671,
    0.1557,
    0.1451,
    0.1351,
    0.1258,
    0.1171,
    0.109,
    0.1014,
    0.0944,
    0.0878,
    0.0817,
    0.076,
    0.0707,
    0.0657,
    0.0612,
    0.0569,
    0.053,
    0.0493,
    0.046,
    0.0428,
    0.0398,
    0.037,
    0.0345,
    0.0321,
    0.0298,
    0.0278,
    0.0259,
    0.024,
    0.0224,
    0.0208,
    0.0194,
    0.018,
    0.0168,
    0.0156,
    0.0145,
    0.0135,
    0.0126,
    0.0117,
    0.0109,
    0.0102,
    0.0095,
    0.0088,
    0.0082,
    0.0076,
    0.0071,
    0.0065,
    0.0061,
    0.0056,
    0.0052,
    0.0048,
    0.0045,
    0.0041,
    0.0038,
    0.0035,
    0.0032,
    0.003,
    0.0027,
    0.0025,
    0.0023,
    0.0021,
    0.0019,
    0.0017,
    0.0016,
    0.0014,
    0.0013,
    0.0012,
    0.001,
    0.0009,
    0.0008,
    0.0007,
    0.0007,
    0.0006,
    0.0005,
    0.0004,
    0.0004,
    0.0003,
    0.0003,
    0.0002,
    0.0002,
    0.0001,
    0.0001,
    0.0001,
    0.0001,
    0.0,
    0.0,
    0.0,
    0.0,
    0.0,
    0.0,
    0.0
   ],
   "ic_superior": [
    1.0,
    0.9956,
    0.9801,
    0.9576,
    0.9299,
    0.898,
    0.8634,
    0.8267,
    0.7889,
    0.7507,
    0.7127,
    0.6753,
    0.6388,
    0.6036,
    0.5697,
    0.5372,
    0.5063,
    0.477,
    0.4491,
    0.4227,
    0.3977,
    0.3739,
    0.3515,
    0.3303,
    0.3103,
    0.2914,
    0.2736,
    0.2567,
    0.2409,
    0.2259,
    0.2118,
    0.1986,
    0.1861,
    0.1744,
    0.1635,
    0.1532,
    0.1435,
    0.1344,
    0.1259,
    0.118,
    0.1105,
    0.1036,
    0.0971,
    0.0909,
    0.0852,
    0.0799,
    0.0749,
    0.0702,
    0.0658,
    0.0618,
    0.0579,
    0.0544,
    0.051,
    0.0479,
    0.0449,
    0.0422,
    0.0396,
    0.0372,
    0.0349,
    0.0328,
    0.0309,
    0.029,
    0.0272,
    0.0256,
    0.0241,
    0.0226,
    0.0213,
    0.02,
    0.0188,
    0.0177,
    0.0166,
    0.0156,
    0.0147,
    0.0138,
    0.013,
    0.0122,
    0.0115,
    0.0108,
    0.0102,
    0.0096,
    0.009,
    0.0085,
    0.008,
    0.0075,
    0.0071,
    0.0067,
    0.0063,
    0.0059,
    0.0056,
    0.0052,
    0.0049,
    0.0046,
    0.0044,
    0.0041,
    0.0038,
    0.0036,
    0.0034,
    0.0032,
    0.003,
    0.0028,
    0.0027,
    0.0025,
    0.0024,
    0.0022,
    0.0021,
    0.002,
    0.0019,
    0.0018,
    0.0017,
    0.0016,
    0.0015,
    0.0014,
    0.0013,
    0.0012,
    0.0012,
    0.0011,
    0.001,
    0.001,
    0.0009,
    0.0009,
    0.0008
   ],
   "quantis_meses": {
    "p50": 15.4,
    "p80": 29.7,
    "p90": 39.9
   }
  },
  {
   "vara": "9001",
   "classe": null,
   "metodo": "kaplan-meier",
   "n": 2430,
   "eventos": 2424,
   "censurados": 6,
   "sobrevivencia": [
    1.0,
    0.9913,
    0.9727,
    0.9467,
    0.9151,
    0.8792,
    0.8403,
    0.7993,
    0.7572,
    0.7147,
    0.6724,
    0.6309,
    0.5905,
    0.5518,
    0.5147,
    0.4794,
    0.446,
    0.4144,
    0.3847,
    0.3569,
    0.3308,
    0.3062,
    0.2833,
    0.2617,
    0.2415,
    0.2227,
    0.2051,
    0.1886,
    0.1732,
    0.1589,
    0.1455,
    0.133,
    0.1215,
    0.1107,
    0.1008,
    0.0916,
    0.0831,
    0.0753,
    0.0681,
    0.0615,
    0.0555,
    0.05,
    0.0449,
    0.0403,
    0.0361,
    0.0324,
    0.0289,
    0.0258,
    0.023,
    0.0204,
    0.0181,
    0.0161,
    0.0143,
    0.0127,
    0.0112,
    0.0098,
    0.0087,
    0.0076,
    0.0067,
    0.0059,
    0.0052,
    0.0045,
    0.004,
    0.0034,
    0.003,
    0.0026,
    0.0022,
    0.0019,
    0.0017,
    0.0015,
    0.0013,
    0.0011,
    0.001,
    0.0008,
    0.0007,
    0.0006,
    0.0005,
    0.0004,
    0.0004,
    0.0003,
    0.0003,
    0.0002,
    0.0002,
    0.0001,
    0.0001,
    0.0001,
    0.0001,
    0.0001,
    0.0001,
    0.0001,
    0.0001,
    0.0001,
    0.0001,
    0.0,
    0.0,
    0.0,
    0.0,
    0.0,
    0.0,
    0.0,
    0.0,
    0.0,
    0.0,
    0.0,
    0.0,
    0.0,
    0.0,
    0.0,
    0.0,
    0.0,
    0.0,
    0.0,
    0.0,
    0.0,
    0.0,
    0.0,
    0.0,
    0.0,
    0.0,
    0.0,
    0.0
   ],
   "ic_inferior": [
    1.0,
    0.9862,
    0.9635,
    0.9341,
    0.8996,
    0.8613,
    0.8202,
    0.7776,
    0.7341,
    0.6906,
    0.6476,
    0.6058,
    0.5654,
    0.5267,
    0.4898,
    0.4548,
    0.4219,
    0.391,
    0.3619,
    0.3348,
    0.3093,
    0.2855,
    0.2632,
    0.2424,
    0.223,
    0.2049,
    0.1879,
    0.1721,
    0.1576,
    0.144,
    0.1313,
    0.1195,
    0.1085,
    0.0983,
    0.089,
    0.0803,
    0.0723,
    0.0649,
    0.0582,
    0.0521,
    0.0464,
    0.0413,
    0.0368,
    0.0326,
    0.0288,
    0.0253,
    0.0222,
    0.0195,
    0.0171,
    0.0148,
    0.0129,
    0.0111,
    0.0096,
    0.0082,
    0.007,
    0.0059,
    0.005,
    0.0042,
    0.0034,
    0.0028,
    0.0023,
    0.0019,
    0.0014,
    0.0011,
    0.0008,
    0.0006,
    0.0004,
    0.0002,
    0.0001,
    0.0,
    0.0,
    0.0,
    0.0,
    0.0,
    0.0,
    0.0,
    0.0,
    0.0,
    0.0,
    0.0,
    0.0,
    0.0,
    0.0,
    0.0,
    0.0,
    0.0,
    0.0,
    0.0,
    0.0,
    0.0,
    0.0,
    0.0,
    0.0,
    0.0,
    0.0,
    0.0,
    0.0,
    0.0,
    0.0,
    0.0,
    0.0,
    0.0,
    0.0,
    0.0,
    0.0,
    0.0,
    0.0,
    0.0,
    0.0,
    0.0,
    0.0,
    0.0,
    0.0,
    0.0,
    0.0,
    0.0,
    0.0,
    0.0,
    0.0,
    0.0,
    0.0
   ],
   "ic_superior": [
    1.0,
    0.9965,
    0.9817,
    0.9592,
    0.9306,
    0.8972,
    0.8604,
    0.8211,
    0.7803,
    0.7387,
    0.6971,
    0.656,
    0.6158,
    0.5769,
    0.5395,
    0.5039,
    0.47,
    0.4379,
    0.4076,
    0.3791,
    0.3522,
    0.327,
    0.3032,
    0.281,
    0.2602,
    0.2406,
    0.2223,
    0.2051,
    0.189,
    0.1741,
    0.16,
    0.1469,
    0.1348,
    0.1235,
    0.113,
    0.1033,
    0.0943,
    0.0859,
    0.0782,
    0.0712,
    0.0646,
    0.0587,
    0.0532,
    0.0481,
    0.0436,
    0.0393,
    0.0355,
    0.0321,
    0.0289,
    0.0261,
    0.0234,
    0.0211,
    0.0189,
    0.0171,
    0.0154,
    0.0138,
    0.0124,
    0.0111,
    0.01,
    0.0089,
    0.008,
    0.0072,
    0.0064,
    0.0058,
    0.0052,
    0.0046,
    0.0042,
    0.0037,
    0.0034,
    0.003,
    0.0027,
    0.0024,
    0.0022,
    0.0019,
    0.0018,
    0.0016,
    0.0014,
    0.0013,
    0.0012,
    0.001,